<?xml version="1.0" encoding="US-ASCII"?>
<!DOCTYPE Corpus SYSTEM "http://www.nist.gov/speech/atlas/aif.dtd">

<Corpus xmlns="http://www.nist.gov/speech/atlas" xmlns:xlink="http://www.w3.org/1999/xlink" xmlns:dc="http://www.ukoln.ac.uk/interop-focus/activities/z3950/int_profile/bath/draft/stable1.html" id="Cor13" AIFVersion="1.1" type="spatialml" schemeLocation="http://callisto.mitre.org/maia/spatialml.maia.xml">
  <Metadata/>
  <SimpleSignal id="Sig13" type="text" mimeClass="text" mimeType="sgml" xlink:href="MARKETVIEW_20050217.2115.sgm" encoding="UTF-8" track="ALL" xlink:type="simple">
    <body encoding="Base64">PERPQz4NCg0KIE1BUktFVFZJRVdfMjAwNTAyMTcuMjExNSANCiBXRUIgVEVYVCANCiAyMDA1LTAyLTE3VDIxOjE1OjAwIA0KDQoNCkFuIEFpcmxpbmUgUGFzc2VuZ2VyJ3MgQmlsbCBvZiBSaWdodHM/DQoNCjxURVhUPg0KDQoNCiBCeXJuZSANCiAyMDA1LTAyLTE3VDIxOjE1OjAwIA0KSGFzIHRoZSBFVSBvbmNlIGFnYWluIGxvc3QgaXRzIG1pbmQ/IFRoZSBvbmUgaW5kdXN0cnkgaW4gd2hpY2ggRXVyb3BlDQppbmNvbnRyb3ZlcnRpYmx5IGJlYXRzIHRoZSBVUyBpcyB0aGVpciBhdmlhdGlvbiBpbmR1c3RyeSAsIHRoYW5rcyBtYWlubHkNCnRvIHRoZSBmYWN0IHRoYXQgdGhlaXIgbGF3bWFrZXJzIGhhdmUgbGVmdCB0aGUgb3BlcmF0aW9uIG9mIHRoZSBpbmR1c3RyeQ0KdXAgdG8gdGhlIHBlb3BsZSB3aG8gb3duIGl0LCBhbmQgbGVmdCBwYXNzZW5nZXIncyByaWdodHMgaW4gdGhlIGhhbmRzIG9mDQpjaG9vc3kgcGFzc2VuZ2Vycy4gQW5kIG5vdyB0aGV5J3JlIHJlYWR5IHRvICdmaXgnIHRoYXQgd2l0aCBhIG5ldw0KcGFja2FnZSBvZiBpbGwtYWR2aXNlZCBydWxlcyBjb21wbGV0ZWx5IGNoYW5naW5nIHRoZSBuYXR1cmUgb2YgYWlybGluZXMNCi4gQmVmb3JlLCBhIHBvdGVudGlhbCBjdXN0b21lciBjb3VsZCBjaG9vc2UgYmV0d2VlbiBhIGNvc3ksIG5lYXItY2VydGFpbg0KcmlkZSBmcm9tIGFuIGV4cGVuc2l2ZSBjb21wYW55IG9yIGEgaHVzdGxlZCwgdW5jb21mb3J0YWJsZSwgYW5kIGFic3VyZGx5DQpjaGVhcCBvbmUgZnJvbSBhIHNtYWxsZXIgY29tcGV0aXRvci4gQW5kIG5vdz8gTm90IGEgY2hhbmNlLg0KDQo8L1RFWFQ+DQoNCg0KPC9ET0M+</body>
  </SimpleSignal>
  <AnchorSet containedType="text-point">
    <Anchor id="Anc28" type="text-point">
      <Parameter type="char" unit="NULL_UNIT" role="char">214</Parameter>
      <SignalRef xlink:href="#Sig13" role="text" xlink:type="simple"/>
    </Anchor>
    <Anchor id="Anc29" type="text-point">
      <Parameter type="char" unit="NULL_UNIT" role="char">220</Parameter>
      <SignalRef xlink:href="#Sig13" role="text" xlink:type="simple"/>
    </Anchor>
    <Anchor id="Anc30" type="text-point">
      <Parameter type="char" unit="NULL_UNIT" role="char">249</Parameter>
      <SignalRef xlink:href="#Sig13" role="text" xlink:type="simple"/>
    </Anchor>
    <Anchor id="Anc31" type="text-point">
      <Parameter type="char" unit="NULL_UNIT" role="char">251</Parameter>
      <SignalRef xlink:href="#Sig13" role="text" xlink:type="simple"/>
    </Anchor>
  </AnchorSet>
  <RegionSet containedType="link-subordinates"/>
  <RegionSet containedType="path-subordinates"/>
  <RegionSet containedType="text-extent">
    <Region id="Reg12" type="text-extent">
      <AnchorRef xlink:href="#Anc29" role="end" xlink:type="simple"/>
      <AnchorRef xlink:href="#Anc28" role="start" xlink:type="simple"/>
    </Region>
    <Region id="Reg13" type="text-extent">
      <AnchorRef xlink:href="#Anc31" role="end" xlink:type="simple"/>
      <AnchorRef xlink:href="#Anc30" role="start" xlink:type="simple"/>
    </Region>
  </RegionSet>
  <Analysis id="Ana73" type="link-extent-set" role="link-extent-set">
    <AnnotationSet containedType="link-extent"/>
  </Analysis>
  <Analysis id="Ana74" type="link-set" role="link-set">
    <AnnotationSet containedType="LINK"/>
  </Analysis>
  <Analysis id="Ana75" type="path-extent-set" role="path-extent-set">
    <AnnotationSet containedType="path-extent"/>
  </Analysis>
  <Analysis id="Ana76" type="path-set" role="path-set">
    <AnnotationSet containedType="PATH"/>
  </Analysis>
  <Analysis id="Ana77" type="place-set" role="place-set">
    <AnnotationSet containedType="PLACE">
      <Annotation id="Ann12" type="PLACE">
        <RegionRef xlink:href="#Reg12" role="text-extent" xlink:type="simple"/>
        <Content type="place-content">
          <Parameter type="string" unit="NULL_UNIT" role="continent">EU</Parameter>
          <Parameter type="string" unit="NULL_UNIT" role="description"/>
          <Parameter type="string" unit="NULL_UNIT" role="form">NAM</Parameter>
          <Parameter type="string" unit="NULL_UNIT" role="gazref">IGDB:30064878</Parameter>
          <Parameter type="string" unit="NULL_UNIT" role="id">Pl-1</Parameter>
          <Parameter type="string" unit="NULL_UNIT" role="nonLocUse"/>
          <Parameter type="string" unit="NULL_UNIT" role="type">CONTINENT</Parameter>
        </Content>
      </Annotation>
      <Annotation id="Ann13" type="PLACE">
        <RegionRef xlink:href="#Reg13" role="text-extent" xlink:type="simple"/>
        <Content type="place-content">
          <Parameter type="string" unit="NULL_UNIT" role="country">US</Parameter>
          <Parameter type="string" unit="NULL_UNIT" role="description"/>
          <Parameter type="string" unit="NULL_UNIT" role="form">NAM</Parameter>
          <Parameter type="string" unit="NULL_UNIT" role="gazref">IGDB:840</Parameter>
          <Parameter type="string" unit="NULL_UNIT" role="id">Pl-2</Parameter>
          <Parameter type="string" unit="NULL_UNIT" role="nonLocUse"/>
          <Parameter type="string" unit="NULL_UNIT" role="type">COUNTRY</Parameter>
        </Content>
      </Annotation>
    </AnnotationSet>
  </Analysis>
  <Analysis id="Ana78" type="signal-set" role="signal-set">
    <AnnotationSet containedType="SIGNAL"/>
  </Analysis>
</Corpus>
