<?xml version="1.0" encoding="US-ASCII"?>
<!DOCTYPE Corpus SYSTEM "http://www.nist.gov/speech/atlas/aif.dtd">

<Corpus xmlns="http://www.nist.gov/speech/atlas" xmlns:xlink="http://www.w3.org/1999/xlink" xmlns:dc="http://www.ukoln.ac.uk/interop-focus/activities/z3950/int_profile/bath/draft/stable1.html" id="Cor7" AIFVersion="1.1" type="spatialml" schemeLocation="http://callisto.mitre.org/maia/spatialml.maia.xml">
  <Metadata/>
  <SimpleSignal id="Sig7" type="text" mimeClass="text" mimeType="sgml" xlink:href="misc.kids.pregnancy_20050120.0404.sgm.sgml" encoding="UTF-8" track="ALL" xlink:type="simple">
    <body encoding="Base64">PERPQz4NCg0KIG1pc2Mua2lkcy5wcmVnbmFuY3lfMjAwNTAxMjAuMDQwNCANCiBXRUIgVEVYVCANCiAyMDA1LTAxLTIwVDA0OjA0OjAwIA0KDQoNClRoZSBQYWluIG9mIENoaWxkYmlydGgNCg0KPFRFWFQ+DQoNCg0KIEFubmEgTWMgDQogVGh1LCAyMCBKYW4gMjAwNSAxMDowNDoxOSArMDEwMCANCiBUaGUgUGFpbiBvZiBDaGlsZGJpcnRoIA0KDQpJIGhhdmUgMiBnaXJscyBhbHJlYWR5LCBuZWFybHkgOCBhbmQgNC41IHlycyBhbmQgSSBoYXZlIGFsd2F5cyBzYWlkIEkNCndpbGwgTkVWRVIgZm9yZ2V0IHRoZSBwYWluIG9mIGNoaWxkYmlydGguIEFiYnkgd2FzIGEgdHJ1ZSB3YXRlciBiaXJ0aA0KKDNrZyAtIG5vcm1hbCkgYW5kIHdpdGggRmlvbmEgSSB3YXMgZHJhZ2dlZCBvdXQgb2YgdGhlIHBvb2wgYWZ0ZXIgdGhlDQpoZWFkIGNyb3duZWQgKGd5bm8gaGFkIHdyaXR0ZW4gb24gbXkgbm90ZXMgc2hlIHdhcyA0a2cgKGxhcmdlKSBhbmQgdGhhdA0Kc2hlIHdhcyBub3QgdG8gYmUgYm9ybiBpbiB0aGUgd2F0ZXIgKGxvbmcgcGFpbmZ1bCBzdG9yeSEpIEkgY2FuIHN0aWxsDQpyZW1lbWJlciB0aG91Z2ggdGhlIHBhaW4gSSBmZWx0LiBJIGFtIG9uIHRoZSBsYXJnZSBzaWRlIGJ1dCBJIGFtIHNvDQp3b3JyaWVkIGFib3V0IGhvdyBJJ20gZ29pbmcgdG8gY29wZSB3aXRoIGEgbmF0dXJhbCBjaGlsZGJpcnRoIHdpdGhvdXQgYQ0KcG9vbCAobm90IGF2YWlsYWJsZSByb3VuZCBoZXJlKS4gSSd2ZSBzZWVuIHZpZGVvcyBhbmQgaGVhcmQgb2YgbGFkaWVzDQp3aG8gaGF2ZSAibWFuYWdlZCIgdGhlaXIgcGFpbiBjb250cm9sLiBIb3cgaW4gSGVhdmVucyBuYW1lIGNhbiB5b3UgZG8NCnRoYXQ/IEkndmUgYmVlbiB0aGVyZTsgSSBrbm93IHdoYXQgdGhlIHBhaW4gZmVlbHMgbGlrZSEhDQoNCkNhbiBhbnlvbmUgZ2l2ZSBtZSBhZHZpY2Ugb3IgbGV0IG1lIGtub3cgb2YgYW55IHRlY2huaXF1ZXMgd2hpY2ggbWlnaHQNCmJlIGFibGUgdG8gaGVscD8gVGhhbmtzIGluIGFkdmFuY2UuDQoNCkFubmEgTWMNCg0KDQoNCiBEYWdueSANCiBUaHUsIDIwIEphbiAyMDA1IDA2OjA4OjMwIC0wNTAwIA0KIFJlOiBUaGUgUGFpbiBvZiBDaGlsZGJpcnRoIA0KDQoNCiAgICANCg0KSWYgeW91IGRvbid0IGhhdmUgYW4gaW5zdGl0dXRpb25hbCB3YXRlciBiaXJ0aCBhdmFpbGFibGUsIGhhdmUgeW91DQpjb25zaWRlcmVkIGp1c3Qgc3RheWluZyBob21lPyBVbmFzc2lzdGVkIG9yIG1pZHdpZmUgYXR0ZW5kZWQ/DQoNCkkgdW5kZXJzdGFuZCBoeXBub2JpcnRoaW5nIGNhbiBiZSB2ZXJ5IGhlbHBmdWwuIEkgYW0gbm90IHB1cnN1aW5nIGl0DQpiZWNhdXNlIEkgd2FzIGFibGUgdG8gZ28gaW5zaWRlIHRoZSBwYWluIHRvIHRoZSBnb29kIHBsYWNlIHdpdGhvdXQgdHJhaW5pbmcsDQpsYXN0IHRpbWUuDQoNCkkgaGF2ZSBub3QgYmVlbiB0aGlua2luZyBtdWNoIGFib3V0IHRoZSBoYXJkIHBhcnQgb2YgbGFib3IgcHJpb3IgdG8gZ2V0dGluZw0Kc28gY2xvc2UuIE5vdyBJIHJlbWVtYmVyIGhvdyBpbnRlbnNlIGl0IGlzLiBJIHRoaW5rIEkgYW0gc3RpbGwgbG9va2luZw0KZm9yd2FyZCB0byBpdCBtb3JlIHRoYW4gZmVhcmluZyBpdCwgYnV0IGhleS4gSXQncyBhIHJlYWxseSBpbnRlbnNlLA0KdnVsbmVyYWJsZSB0aGluZy4NCg0KLS0gRGFnbnkNCg0KDQoNCiBXZWxjaGVzIA0KIFRodSwgMjAgSmFuIDIwMDUgMTU6NTI6NDkgR01UIA0KIFJlOiBUaGUgUGFpbiBvZiBDaGlsZGJpcnRoIA0KDQogICAgDQoNCklmIHlvdSBnbyBmb3IgYSBob21lIGJpcnRoIHlvdSBjYW4gcmVudCBhIGJpcnRoaW5nIHBvb2wuDQpJIHdvdWxkbid0IG5lY2Vzc2FyaXRseSBzYXkgdGhhdCB5b3Ugd2lsbCBoYXZlIGEgcmVwZWF0IGxhYm91ciENCk15IGZpcnN0IGxhYm91ciBJIHdhcyAzMCBob3VycyBhbmQgaGFkIGFuIGVwaWR1cmFsIGFmdGVyIDIyIGhvdXJzLg0KIzIgSSB3ZW50IGluIHNheWluZyAiZ2l2ZSBtZSB0aGUgZXBpZHVyYWwgYXNhcC1hbmQgbmV2ZXIgZ290IHRvIHRoZSBzdGF0ZQ0Kd2hlcmUgSSBmZWx0IHRoYXQgSSBuZWVkZWQgaXQuIE9ubHkgaGFkIHRlbnMgYW5kIGdhcy1hbmQtYWlyLiBTbyBkb24ndCBnaXZlDQp1cCBvbiB0aGUgaWRlYSBvZiBhIG5hdHVyYWwgYmlydGggYmVjYXVzZSBsYXN0IHRpbWUgd2FzIHBhaW5mdWwuDQpJIHRoaW5rIGRpZmZlcmVudCBwZW9wbGUvZGlmZmVyZW50IGxhYm91cnMgYXJlIGRpZmZlcmVudCwgc28ganVzdCBiZWNhdXNlDQpvbmUgcGVyc29uIHNheXMgIkkgZGlkICoqKiBhbmQgaXQgZGlkbid0IGh1cnQgYSBiaXQiIGRvZXNuJ3QgbWVhbiB0aGF0IGl0DQp3aWxsIHdvcmsgZm9yIHNvbWVvbmUgZWxzZSwgc28gZ29pbmcgaW4gd2l0aCBhIHNldCBvZiBzdWdnZXN0aW9ucywgYW5kIGJlaW5nDQpwcmVwYXJlZCB0byB0cnkgdGhlbSBhbmQgc2VlIHdoaWNoIGlzIHRoZSBiZXN0IGlzIHByb2JhYmx5IHRoZSBtb3N0IGhlbHBmdWwuDQooT2ggYW5kICJpdCBkaWRuJ3QgaHVydCBhIGJpdCIgaXMgdXN1YWxseSBoZWxwZWQgYnkgbXVtbXkgYW1uZXNpYSEhOy1QKQ0KRGViYmllDQoNCg0KPC9URVhUPg0KDQoNCjwvRE9DPg==</body>
  </SimpleSignal>
  <AnchorSet containedType="text-point"/>
  <RegionSet containedType="link-subordinates"/>
  <RegionSet containedType="path-subordinates"/>
  <RegionSet containedType="text-extent"/>
  <Analysis id="Ana37" type="link-extent-set" role="link-extent-set">
    <AnnotationSet containedType="link-extent"/>
  </Analysis>
  <Analysis id="Ana38" type="link-set" role="link-set">
    <AnnotationSet containedType="LINK"/>
  </Analysis>
  <Analysis id="Ana39" type="path-extent-set" role="path-extent-set">
    <AnnotationSet containedType="path-extent"/>
  </Analysis>
  <Analysis id="Ana40" type="path-set" role="path-set">
    <AnnotationSet containedType="PATH"/>
  </Analysis>
  <Analysis id="Ana41" type="place-set" role="place-set">
    <AnnotationSet containedType="PLACE"/>
  </Analysis>
  <Analysis id="Ana42" type="signal-set" role="signal-set">
    <AnnotationSet containedType="SIGNAL"/>
  </Analysis>
</Corpus>
