<?xml version="1.0" encoding="US-ASCII"?>
<!DOCTYPE Corpus SYSTEM "http://www.nist.gov/speech/atlas/aif.dtd">

<Corpus xmlns="http://www.nist.gov/speech/atlas" xmlns:xlink="http://www.w3.org/1999/xlink" xmlns:dc="http://www.ukoln.ac.uk/interop-focus/activities/z3950/int_profile/bath/draft/stable1.html" id="Cor389" AIFVersion="1.1" type="spatialml" schemeLocation="http://callisto.mitre.org/maia/spatialml.maia.xml">
  <Metadata/>
  <SimpleSignal id="Sig389" type="text" mimeClass="text" mimeType="sgml" xlink:href="MARKETVIEW_20050209.1923.sgml.sgml" encoding="UTF-8" track="ALL" xlink:type="simple">
    <body encoding="Base64">PERPQz4KCiBNQVJLRVRWSUVXXzIwMDUwMjA5LjE5MjMgCiBXRUIgVEVYVCAKIDIwMDUtMDItMDlUMTk6MjM6MDAgCgoKU2lyaXVzIFNhdGVsbGl0ZSAtLSBCcmlsbGlhbnQgUGxhbiwgb3IgR3Jhc3BpbmcgYXQgU3RyYXdzPwoKPFRFWFQ+CgoKIEJ5cm5lIAogMjAwNS0wMi0wOVQxOToyMzowMCAKTWVsIEthcm1hemluIGlzIHB1c2hpbmcgdG8gYWRkIFNpcml1cyBTYXRlbGxpdGUgc2VydmljZXMgdG8gaVBvZHMgLS0KYW4gaW50ZXJlc3RpbmcgaWRlYSwgaW5hc211Y2ggYXMgaXQgc2VlbXMgdG8gZGVmZWF0IHRoZSBwdXJwb3NlIG9mIGJvdGguClRoZSBpUG9kJ3MgdGhlIHRpbmllc3QgcG9zc2libGUgY29udGFpbmVyIGZvciB2YXN0IG11c2ljIGxpYnJhcmllcywgYW5kClNpcml1cyBpcyBhIHdheSB0byBnZXQgYXQgbG90cyBvZiBjb250ZW50IHdoZW4gc2FpZCBtdXNpYyBsaWJyYXJ5IGlzCnVuYXZhaWxhYmxlLiBPbiB0aGUgb3RoZXIgaGFuZCwgS2FybWF6aW4gYW5kIEpvYnMgYXJlIHR3byBvZiB0aGUKc21hcnRlc3QgZGVhbG1ha2VycyBhcm91bmQsIHNvIHRoZXkgbWlnaHQgZmluZCBhIHdheSB0byBzdHJ1Y3R1cmUgdGhpcwpvciBzcGluIGl0IHRvIHRoZSBiZW5lZml0IG9mIGV2ZXJ5b25lLiBNeSBtYWluIHN1c3BpY2lvbiBpcyB0aGF0IHRoaXMgaXMKS2FybWF6aW4gaG9waW5nIHRvIHNlZSB0aGUgcGhyYXNlICZxdW90O01lbCBLYXJtYXppbiwgQ0VPIFsmcXVvdDtUaGF0J3MgcmlnaHQsJnF1b3Q7Ck1lbCBzYXlzIHRvIGhpbXNlbGYsICZxdW90O0MtRS1mcmlnZ2luLSBPICEmcXVvdDtdIG9mIFNpcml1cyBTYXRlbGxpdGUgUmFkaW8uLi4mcXVvdDsKCgogaXJhLWNhbSAKID8/Pz8tPz8tPz9UMjM6NTg6MDAgClN0ZXZlIEpvYnMga25vd3MgYSBiYWQgaWRlYSB3aGVuIGhlJ3MgcGl0Y2hlZCBpdCwgZm9yIGV4YWN0bHkgdGhlCnJlYXNvbnMgeW91IHBvaW50IG91dC4gUGx1cywgYSBzYXRlbGxpdGUgcmVjZWl2ZXIgYnVybnMgYSBsb3Qgb2YgcG93ZXIsCmV2ZW4gaWYgaXQgY291bGQgYmUgbWFkZSB0aW55LgoKCiBCeXJuZSAKID8/Pz8tPz8tPz9UMTI6MDQ6MDAgCk9uIHRoZSBvdGhlciBoYW5kLCB0aGUgZ3V5IGhhcyBjb252aW5jZWQgc29tZSB2ZXJ5IHNtYXJ0IHBlb3BsZSB0bwpzcGVuZCBodWdlIHN1bXMgb24gc3R1cGlkIGlkZWFzIC0tIHRoZXJlIGlzbid0IG11Y2ggdGFsayBhYm91dCBpdCBub3csCmJ1dCBiYWNrIHdoZW4gaGlzIHJlcHV0YXRpb24gd2Fzbid0IHNvIGhvdCAobGF0ZSAnODBzKSwgbG90cyBvZgpqb3VybmFsaXN0cyB0YWxrZWQgYWJvdXQgdGhlICZxdW90O1N0ZXZlIEpvYnMgUmVhbGl0eSBEaXN0b3J0aW9uIEZpZWxkLiZxdW90OyBIZQpjb3VsZCBnZXQgcGVvcGxlIHRvIGlnbm9yZSBldmVyeSBzaW5nbGUgdGVjaG5pY2FsIG9ic3RhY2xlIHRvIGFuIGlkZWEsCmFuZCBpbnZlc3Qgb24gdGhlIGJhc2lzIG9mIHNvbWV0aGluZyBiZWF1dGlmdWxseSwgYnV0IHJpZGljdWxvdXNseSwKc2ltcGxlLiBCYXNpY2FsbHksIGhlIHNlbGxzIHRoZSBmdXR1cmU7IHRoZSBpUG9kIGFuZCB0aGUgTWFjIE1pbmkgYXJlCmp1c3QgdGltZXMgaGUgZ290IGx1Y2t5IGFuZCB0aGUgZnV0dXJlIGNhdWdodCB1cC4KCgogam9udGFpdCAKID8/Pz8tPz8tPz9UMTc6MzI6MDAgClllYS4KClllYS4KClllYS4KCkknbSB0aGUgcHJlc2lkZW50LiBPaCB5ZWEhCgpPaCB5ZWEhCgooeW91IGR1bWJhc3MpCgoKIGpvbnRhaXQgCiA/Pz8/LT8/LT8/VDE3OjQyOjAwIApjb21tZXJjaWFsIEEgdmlkZW8gb2YgYSBjb21tZXJjaWFsIGluIGNhc2Ugbm9ib2R5IGtub3dzIHdoYXQgSSZxdW90O20KdGFsa2luZyBhYm91dCA9KQoKPC9URVhUPgoKCjwvRE9DPg==</body>
  </SimpleSignal>
  <AnchorSet containedType="text-point"/>
  <RegionSet containedType="link-subordinates"/>
  <RegionSet containedType="rlink-subordinates"/>
  <RegionSet containedType="text-extent"/>
  <Analysis id="Ana2329" type="link-extent-set" role="link-extent-set">
    <AnnotationSet containedType="link-extent"/>
  </Analysis>
  <Analysis id="Ana2330" type="link-set" role="link-set">
    <AnnotationSet containedType="LINK"/>
  </Analysis>
  <Analysis id="Ana2331" type="place-set" role="place-set">
    <AnnotationSet containedType="PLACE"/>
  </Analysis>
  <Analysis id="Ana2332" type="rlink-extent-set" role="rlink-extent-set">
    <AnnotationSet containedType="rlink-extent"/>
  </Analysis>
  <Analysis id="Ana2333" type="rlink-set" role="rlink-set">
    <AnnotationSet containedType="RLINK"/>
  </Analysis>
  <Analysis id="Ana2334" type="signal-set" role="signal-set">
    <AnnotationSet containedType="SIGNAL"/>
  </Analysis>
</Corpus>
